{
  "schema_version": "1.0.0",
  "session_id": "sess-fixture",
  "event_id": "sess-fixture:mv:00000003",
  "execution_id": "sess-fixture:exec:1",
  "movement_id": "badminton.lunge",
  "phase_id": "bottom",
  "start_ms": 1200,
  "end_ms": null,
  "confidence": 0.88,
  "evidence_frames": [
    40,
    41,
    42
  ],
  "state": "EXECUTING",
  "model_version": "heuristic_phase_segmenter@1.0.0",
  "unknown_reason": null,
  "contact_evidence": "unobserved",
  "retrospective": false,
  "sport_pack_id": "badminton",
  "sport_pack_version": "1.0.0"
}
